,PROJECT_ID,ABSTRACT,PROJECT_TERMS,PROJECT_TITLE,DEPARTMENT,AGENCY,PROJECT_START_DATE,PROJECT_END_DATE,FY,FY_TOTAL_COST
43,90100,"SES-0817659Rachel L. EinwohnerPurdue UniversityThis study asks: Why does resistance take place in some situations but not others? What conditions facilitated the emergence of collective armed resistance? While current theories of social movement emergence argue that collective action occurs when groups of individuals have opportunity, resources, and a sense of efficacy, this study will make a contribution by examining resistance under conditions of extreme repression, limited resources, and great despair.  This research will study Jewish victims of the Holocaust who are commonly portrayed as passive individuals. Yet well known cases of Jewish resistance such as the Warsaw Ghetto Uprising demonstrate that in at least some places, Jews did rise up against their oppressors. Jewish ghettos in Nazi-occupied Europe therefore provide a useful setting for an empirical study of the emergence of collective resistance under extreme circumstances. This project will make a contribution to the extant literature by examining an understudied context for collective action and use the results to develop new theoretical models. The investigator will conduct in-depth qualitative analysis and compare three strategically selected case studies: the Warsaw Ghetto (where collective Jewish resistance occurred), the Vilna Ghetto (where collective resistance was planned but not achieved), and the Lodz Ghetto (where collective resistance was never attempted). Data will include both primary and secondary sources, including transcripts from a random sample (N=120) of archived oral testimonies from survivors of each ghetto (40 from each ghetto). These testimonies are housed at the University of Southern California Shoah Foundation Institute. Oral testimony data will be analyzed using the qualitative software package NVivo.The study?s broader impacts are both educational and policy-related. First, the project will help contribute to extant knowledge about collective action and contentious politics in general. Although the results are intended primarily for professional academic audiences, they may also be used in other educational settings (e.g., Holocaust education in public schools). In addition, to the extent that they are disseminated more widely (e.g., through the media), the findings can also have an impact on the general public?s understanding of the Holocaust, especially by helping to dispel the myth of Jewish passivity. Lastly, the findings will have relevance to contemporary cases of resistance such as armed insurgencies, prison revolts and urban riots.",Archives; arm; California; Case Study; Computer software; Data; Education; Europe; follower of religion Jewish; Foundations; General Population; Ghetto; Holocaust; Housing; Individual; Institutes; Jews; Knowledge; Literature; Nazi; Oral; Policies; Politics; Prisons; Repression; Research; Research Personnel; Resistance; Resources; Riots; Sampling; Schools; social movement; Source; Survivors; Theoretical model; theories; Transcript; Universities,EXPLAINING COLLECTIVE ACTION UNDER EXTREME CIRCUMSTANCES,NSF,NSF,9/15/2008,12/31/2010,2008,114380.0
44,90103,"In most areas of human knowledge, the information revolution has resulted in a massive data explosion. The scale of data sets, their distributed and heterogeneous nature, and the need to quickly deliver results easily interpretable by non-experts, raise new theoretical and computational challenges for statistical learning, from variable selection and structural inference to visualization and online learning. This project uses sparse statistical inference as a powerful approach to meet these challenges. Its key insight is that seeking sparsity is a meaningful way of simultaneously stabilizing inference procedures, and highlighting structure in the underlying data. This work thus combines fundamental advances in sparse statistical learning with cutting-edge computational tools from mathematical programming to create a new framework for structural knowledge discovery in large-scale, streaming data sets. It is focused on two fundamental themes in sparse inference: variable selection and structural inference. Variable selection seeks to isolate a few key variables from high dimensional data sets and is a fundamental preprocessing tool in statistical learning. Structural inference then aims to consistently identify a few core dependence relationships among these variables to highlight its structure. From a computational point of view, many recent results in machine learning have relied on advanced methods from convex optimization such as semidefinite programming and robust optimization and this project seeks to improve the complexity of these algorithms and their capacity to handle very-large scale, streaming data.  In practice, this project is motivated by the desire to help the public understand our democracies by analyzing large-scale political and social data sets, with a particular focus on voting records, online news sources, and polling data. Its approach is to apply statistical inference principles to social sciences, using collaborations with experts in political science and economics to forge the models and techniques under study. In carrying out the research, this project will be training graduate students from statistics, electrical engineering/financial engineering into interdisciplinary researchers at the interface of statistics, optimization, and subject matter areas such as finance and political science. In addition we plan to develop a web site, accessible first to a restricted set of social science researchers, to allow them to analyze mid-sized corpora of online news in text format, in the form of say, sparse graphs of words showing statistical associations between given keywords. The PIs plan to develop a software toolbox implementing these results, interfaced with common numerical packages such as MATLAB, R or python as well as an undergraduate course on ``Statistical Analysis of Online Data  at Berkeley and Princeton, incorporating some of the material produced in this project into the course program.",Algorithms; Area; Collaborations; Computer software; computerized tools; Data; Data Set; Democracy; Dependence; Economics; Electrical Engineering; Engineering; Explosion; forging; graduate student; Graph; Human; Imagery; improved; insight; Knowledge; Knowledge Discovery; Learning; Machine Learning; meetings; Methods; Modeling; Nature; news; Procedures; programs; Pythons; Records; Research; Research Personnel; Research Project Grants; Science; social; Social Sciences; Source; statistics; Stream; Structure; Techniques; Text; tool; Training; Voting; web site; Work,CDI TYPE II: COLLABORATIVE RESEARCH: SPARSE INFERENCE: NEW TOOLS FOR STRUCTURAL KNOWLEDGE DISCOVERY,NSF,NSF,9/15/2008,2/28/2013,2008,1341676.0
45,90104,"Designing a response to global climate change requires analysis tools that can help decision makers understand the tradeoffs between the cost of a policy and its benefit in the form of avoided climate change. Both the costs and the benefits, however, are uncertain. To date, models used in studies of climate change have not represented all the critical uncertainties. One important omission is the representation of uncertainty in returns to research and development (R&D) directed to the improvement of energy technologies. Studies on R&D have shown that such returns are uncertain and highly skewed (i.e., have a small probability of a very large breakthrough). Ignoring this uncertainty and focusing on the average effect will produce biased estimates of the emissions reductions required to meet particular targets or the relative balance between near-term emissions constraints and investments in energy technology R&D.This research will improve the analysis tools available to decision makers by developing a model framework that explicitly represents the uncertainty in the returns to R&D. The representation of technical change and its relation to R&D expenditure will be calibrated to historical experience with U.S. patents. The model will also improve the representation of the uncertainty in the climate response to greenhouse gas emissions by constraining that uncertainty to a range consistent with 20th century climate. These components will be integrated into a single framework that can be used to explore decision making about emissions reductions and R&D expenditures under uncertainty.The results of this research will improve the analysis facilities that are applied to climate change assessment. The new tools are expected to give improved guidance in the timing of emissions reductions and investments in technology R&D by eliminating biases in current models.",Climate; climate change; cost; Costs and Benefits; Decision Making; design; Equilibrium; Expenditure; experience; greenhouse gases; improved; Investments; Legal patent; meetings; Modeling; Policies; Probability; Relative (related person); Research; research and development; response; Technology; Time; tool; Uncertainty,COLLABORATIVE RESEARCH: DRU: AN IMPROVED MODEL OF ENDOGENOUS TECHNICAL CHANGE CONSIDERING UNCERTAIN R&D RETURNS AND UNCERTAIN CLIMATE RESPONSE,NSF,NSF,9/15/2008,8/31/2012,2008,442082.0
46,90105,"CBET-0838607DozierThe WATERS Network is an initiative to transform science and engineering of the water environment.  The goal is to create a national capability to better predict and manage the behavior of water-and its nutrients, contaminants, and sediments-everywhere in the U.S.  Population growth, evolving land use, and climate change make the future water environment uncertain, so prediction and management require understanding along with statistical relationships, and thereby require integration among people who study how water moves and transforms landscapes; who manage and treat water to ensure potable supplies and prevent floods; and who consider how humans, institutions, and managed systems respond to and superimpose variability on quality, scarcity, or hazard. Driving the requirement for an integrated, collaboratively developed infrastructure is the recognition that we have to predict and manage water nationwide.  Predicting Water Quality and Quantity Everywhere at All Times (WQ2EAT) requires a judicious integration of models and syn-thesis, cyberinfrastructure, education and outreach, existing networks, and remotely sensed data, along with new measurements, analyses, and experiments at a realistic number of carefully chosen sites or basins.  A network of observational and experimental facilities, where processes are studied and manipulated, will provide knowledge that can be transferred to any location on the continent.  The proposed network spans the domain of water environments-pristine, rural, and urban areas and constructed networks and facilities for management and treatment.  The capacity for prediction ranges from episodic events such as floods and storm-water overflows, through seasonal spring runoff and surges of agricultural wastes, to multi-decadal projections.The task of the investigation is to create a prototype network design that will enable detailed specification and budgeting to prepare for a conceptual design review.  The investigation will analyze existing sources of data across a domain representing the extant human-influenced water environment, conduct modeling exercises to identify new measurement needs and predict in locations where we lack intensive measurements, and scrutinize emerging technologies and different variables to observe at different scales.  Alternative observational designs, as well as experimental facilities and campaigns, will be evaluated according to their capability to support key scientific objectives. The WATERS Network will help us understand and predict the ways in which heterogeneous processes interact with one another at different scales to produce the variability found in the water environment.  Knowledge about explicitly scale-dependent processes will thereby inform options for management and engineering design. Water for human consumption, agriculture, and industrial processes is perhaps humanitys most fundamental need.  Our traditional methods of predicting and managing water and its quality are based on statistical relations developed when human impacts were isolated and climate was relatively stable.  These boundary conditions are changing, hence the need for new fundamental understanding.  The WATERS Network focuses on the U.S., but the knowledge gained and the technologies developed will apply globally.",Agriculture; Automobile Driving; base; Behavior; Budgets; Climate; climate change; Consumption; Data; Data Sources; design; Education and Outreach; Emerging Technologies; Engineering; engineering design; Ensure; Event; Exercise; Floods; Future; Goals; hazard; Human; Institution; Investigation; Knowledge; land use; Location; Measurement; Methods; Modeling; Nutrient; Population Growth; prevent; Process; prototype; Research Infrastructure; research study; Rural; Science; Site; System; systems research; Technology; Time; urban area; wasting; Water; water environment; water quality,SCIENCE PLAN OF THE WATER AND ENVIRONMENTAL RESEARCH SYSTEMS NETWORK (WATERS NETWORK),NSF,NSF,10/1/2008,12/31/2010,2008,900000.0
47,89960,IMPACT MECHANICS AND CENTRAL PIT FORMATION ON ICY SATELLITES Central pit craters are an unusual morphological class of impact crater seen most commonly on the large icy satellites Ganymede and Callisto where they replace the peak-ring morphology expected,Ganymede; Mechanics; Morphology,IMPACT MECHANICS AND CENTRAL PIT FORMATION ON ICY SATELLITES CENTRAL PIT CRATERS ARE AN UNUSUAL MORPHOLOGICAL CLASS OF IMPACT CRATER SEEN MOST COMMONLY ON THE LARGE ICY SATELLITES GANYMEDE AND CALLISTO WHERE THEY REPLACE THE PEAK-RING MORPHOLOGY EXPECTED,NASA,NASA,9/17/2008,9/16/2012,2008,188920.0
48,89959,"The earliest detailed records of Australia's indigenous languages date from approximately two hundred years ago, and therefore our only access to the prehistory of Australia's indigenous past is through reconstruction in archeology and linguistics. While we know that humans have lived in Australia for more than 40,000 years, we do not know how speakers of the 250 currently attested languages came to live where they do today. This project uses linguistic evidence to trace the history of Aboriginal people in prehistoric times. Systematic similarities between words in these languages can be used to reconstruct various properties of prehistoric languages. These techniques will be used to determine the structure of the Pama-Nyungan language family, which will shed light on prehistoric population movements.Australia's linguistic prehistory is important for several reasons. It has been claimed that methods developed for Europe and the Americas do not work in Australia. If true, such a finding would be highly important, since these methods are based on properties of language change which until now have been assumed to be universal. However, preliminary work indicates that Australian languages show the same characteristics that we find elsewhere. Small speech community size, widespread multilingualism, and other factors have obscured relationships between these languages. These languages are an excellent laboratory for modeling what language change might have been like before the spread of agricultural communities. If we are ever going to be able to model accurately what prehistoric global language spread might have looked like, we need to understand how it operated in Australia.",Aborigine; Agriculture; Americas; Archaeology; Australia; base; Characteristics; Communities; Europe; Family; Human; Indigenous; Laboratories; Language; Life; Light; Linguistics; Methods; Modeling; Multilingualism; population movement; Property; reconstruction; Recording of previous events; Records; Speech; Structure; Techniques; Time; Work,CAREER: PAMA-NYUNGAN RECONSTRUCTION AND THE PREHISTORY OF AUSTRALIA,NSF,NSF,8/1/2008,6/30/2012,2008,407272.0
49,90112,IMPROVED NUMERICAL MODELING OF GAS-SURFACE INTERACTION IN HYPERSONIC FLOWS  A modification to the NASA DPLR code is proposed to improve the capability of the tool to simulate detailed gas/surface interaction chemistry on TPS materials for applications to,Chemistry; Code; Gases; improved; Modeling; Modification; Simulate; Surface; tool; United States National Aeronautics and Space Administration,IMPROVED NUMERICAL MODELING OF GAS-SURFACE INTERACTION IN HYPERSONIC FLOWS A MODIFICATION TO THE NASA DPLR CODE IS PROPOSED TO IMPROVE THE CAPABILITY OF THE TOOL TO SIMULATE DETAILED GAS/SURFACE INTERACTION CHEMISTRY ON TPS MATERIALS FOR APPLICATIONS TO,NASA,NASA,8/1/2008,11/2/2009,2008,38591.0
50,90115,"The Kentucky (KY) EPSCoR RII-7 proposal unites eight institutions, University of Kentucky, Berea College, Centre College of Kentucky, Kentucky State University, Morehead State University, Northern Kentucky University, University of Louisville, and Eastern Kentucky University, to continue the strategy of investing in infrastructure to develop Kentucky?s ?New Economy? by supporting research in Innovative Materials and Devices.  Intellectual Merit This project will pursue two major research initiatives. Initiative in Innovative Materials and Devices is focused on studies of bulk single-crystal transition metal oxides and epitaxial thin films with complementary functionalities, and applications of multilayered thin films for molecular electrodes as well as for single-molecule magnets. The other part of the project will focus on engineering new platforms to enhance our understanding of a single cell or multiple cell types, interactions between individual cells and cell types, and sensing at the molecular, intracellular and intercellular levels. A statewide Micro/Nano Network will advance micro/nanotechnology and the many fields that utilize this technology.Broader ImpactsKentucky EPSCoR has developed a comprehensive plan for increasing diversity and evaluating progress in that area.  Programs such as seed-funding that supports research at regional institutions and a program to involve diverse populations of Kentucky students in research will be supported through EPSCoR.  A special program for computer science graduate students at Kentucky State University will be introduced.  Kentucky EPSCoR also proposes the cyberinfrastructure plans for the state, and augments them with support for increasing the expertise and developing new sources of talent. The project is consistent with the state?s science and technology plan, and the associated higher education plan.  The project will develop new facilities and establish new faculty and staff positions in the bio-, nano-, & cyber-technology areas.  Kentucky EPSCoR has developed a review process intended to identify infrastructure that should support the most promising research.  A system of evaluation metrics has been developed to determine whether a strategy is working, and if it is improving Kentucky?s competitiveness.",Area; cell type; Cells; college; computer science; Devices; education planning; Electrodes; Engineering; Evaluation; Faculty; Film; Funding; graduate student; improved; Individual; innovation; Institution; Kentucky; metal oxide; Metric; Molecular; molecular film; nano; Nanotechnology; Population Heterogeneity; Positioning Attribute; Process; programs; Research; Research Infrastructure; Research Support; Science; Seeds; single molecule; Source; Students; System; Talents; Technology; Transition Elements; Universities; Work,TRANSFORMING KENTUCKY''S NEW ECONOMY,NSF,NSF,9/1/2008,8/31/2013,2008,7421000.0
51,90119,"The investigators propose to develop and test new instructional techniques aimed at teaching high-school science students how to use the diagrams that appear in their biology textbooks. Research from a range of disciplines has shown that people have difficulty making sense of diagrams. The investigators had previously found that inference and other high-level processes that are important for learning from text are even more important for learning from diagrams. They further showed that students show little gains in content understanding from textbook diagrams. The investigators will capitalize on commonalities among several theories of diagrammatic reasoning to develop four interventions, following an additive design, aimed at improving classroom instruction in how to use diagrams. In each iteration, one additional intervention feature is added to the initial intervention. In the first intervention, they will teach the components of diagrams (i.e., how to read captions, color keys, and other conventions of diagrams). In the second, they will also teach the coordinating of text and diagrams. In the third, they will also have the students engage in self-explanation. In the fourth, they will also have students construct their own drawings. In conjunction with these experimental studies, the investigators will collect eye tracking data on a subset of participants pre- and post-intervention in order to look for possible changes in gaze patterns.",Biology; Color; Data; design; Discipline; Educational process of instructing; Eye; gaze; high school; improved; Instruction; Intervention; Learning; Participant; Pattern; post intervention; Process; Reading; Research; Research Personnel; research study; Science; Students; Techniques; Testing; Text; Textbooks; theories,TEACHING EFFECTIVE USE OF DIAGRAMMATIC REASONING IN BIOLOGY,NSF,NSF,9/15/2008,8/31/2013,2008,999731.0
