,PROJECT_ID,ABSTRACT,PROJECT_TERMS,PROJECT_TITLE,DEPARTMENT,AGENCY,PROJECT_START_DATE,PROJECT_END_DATE,FY,FY_TOTAL_COST
67,89925,"It is often difficult to distinguish whether the graduates of a challenging academic program are successful because of their educational experiences, or whether the program simply selected individuals destined for success into the program.  It is usually impossible to conduct a true experiment with random assignment of students to educational opportunities.  However, large-scale shifts in policy can serve as  natural experiments  that change the way students are matched to educational programs and allow us to identify causal consequences of education.The specific research question addressed by this project is:  Do institution-level shifts in the number of science and engineering degrees conferred lead to measurable changes in graduate outcomes?for example: higher earnings, increased participation in the science and engineering workforce, or a larger probability of filing patents?relative to similar earlier graduates? And how does the research inform the science of science policy?Writing in 1994, William Trent and John Hill described a concerted effort by a group of Historically Black Colleges and Universities (HBCUs) to expand educational opportunities in engineering, computer science and other technical fields,  to prepare their students for expanded career choices.   Preliminary evidence suggests that a shift in the relative participation of black college graduates in occupations related to engineering, math, computer science, or physical sciences (EMS) occurred at about the same time.  Furthermore, growth in EMS college majors was particularly strong among students most likely to attend HBCUs:  those who attended high school in the South.  The initial phase of this project is designed to distinguish whether the growth was driven by HBCU policies, or by change at other southern institutions.  The second phase involves assembling more than 30 years of data on the number and type of degrees conferred by each U.S. institution of higher education (collected annually by the U.S. Department of Education), analyzing the data to find other examples of large institution-level (or state-level) shifts in the number of science and engineering degrees conferred, and combining this information with data from other sources to discover the resulting educational and economic impacts.The initial phase of this research is designed to reveal the institution-level processes underlying recent expansion of science and engineering participation by a persistently underrepresented minority group.  More generally, the research project expands knowledge about the extent to which exposure to science or engineering education at the undergraduate level changes the set of skills college graduates bring to the labor market, and whether that change is substantial enough to affect a whole host of outcome measures including earnings, occupation, and patent activity. Broader ImpactsThe knowledge gained from this research project informs individual-level career-path choices as well as educational and workforce policies.  Educational materials appropriate for middle school or high school students are intended teach fundamental mathematics concepts while they convey motivating information-- derived from this research-- about the economic value of pursuing academically challenging educational programs.",Address; Affect; career; Career Choice; college; computer science; Data; Data Analyses; design; economic impact; economic value; Education; Educational Materials; Educational process of instructing; Employment; Engineering; experience; Exposure to; Growth; high school; Historically Black Colleges and Universities; Individual; innovation; Institution; junior high school; Knowledge; Lead; Legal patent; Marketing; Mathematics; Measurable; middle school; Minority Groups; Natural experiment; Occupations; Outcome; Outcome Measure; Phase; physical science; Policies; Probability; Process; programs; Relative (related person); Research; Research Project Grants; research study; Science; Science Policy; skills; Source; Students; success; Time; Underrepresented Minority; Writing,"(DAT) IMPACTS OF HISTORICALLY BLACK INSTITUTIONS'' POLICIES ON SCIENCE AND ENGINEERING EDUCATION, EMPLOYMENT, EARNINGS AND INNOVATION: A ''NATURAL'' EXPERIMENT",NSF,NSF,1/1/2009,12/31/2012,2008,392518.0
68,89924,LAB-ON-A-CHIP APPLICATIONS OF PERMANENT NONWETTING The proposed research seeks to apply knowledge gained through previous NASA support to a problem of current interest-so-called  lab-on-a-chip  (hereafter abbreviated LOC) or  biochip  processing (Bousse -,biochip; interest; Knowledge; Lab-On-A-Chips; micro-total analysis system; Process; Research; United States National Aeronautics and Space Administration,LAB-ON-A-CHIP APPLICATIONS OF PERMANENT NONWETTING THE PROPOSED RESEARCH SEEKS TO APPLY KNOWLEDGE GAINED THROUGH PREVIOUS NASA SUPPORT TO A PROBLEM OF CURRENT INTEREST-SO-CALLED ''LAB-ON-A-CHIP'' (HEREAFTER ABBREVIATED LOC) OR ''BIOCHIP'' PROCESSING (BOUSSE -,NASA,NASA,6/6/2008,6/5/2012,2008,100000.0
69,90162,ASSESSING THE POTENTIAL FOR LIFE ON AN ASTEROID:  THE NATURAL AND ENGINEERED LIMITS OF ORGANISMS AT EXTREME COLD TEMPERATURES AND EXTREME HIGH RADIATION Asteroids are playing an increasingly significant role in the space program. In 2000 the first ever re,cold temperature; Engineering; Life; Minor Planets; Organism; Play; programs; Radiation; Role,ASSESSING THE POTENTIAL FOR LIFE ON AN ASTEROID: THE NATURAL AND ENGINEERED LIMITS OF ORGANISMS AT EXTREME COLD TEMPERATURES AND EXTREME HIGH RADIATION ASTEROIDS ARE PLAYING AN INCREASINGLY SIGNIFICANT ROLE IN THE SPACE PROGRAM. IN 2000 THE FIRST EVER RE,NASA,NASA,8/7/2008,2/28/2011,2008,201403.0
70,89920,"The Learning Mathematics for Teaching (LMT) project and the Educational Testing Services (ETS) have formed a partnership to construct, pilot test, re-design, validate, and disseminate five assessments of student achievement for use in upper elementary grades as growth-sensitive measures of student learning in mathematics.  The assessments are in the areas of (1) number and operations, (2) pre-algebra and algebra, and (3) geometry and measurement and are based in the literature on student's cognitive growth in these mathematical domains.  The instruments are aligned with the National Council of Teachers of Mathematics' Focal Points and with existing  mathematics knowledge for teaching  (MKT) classroom observation instruments.  These assessments differ from existing assessments in that the questions require more complex responses than typical multiple-choice problems.  Yet, they are still machine-scoreable so they can easily be used in studies with large student samples.  Additionally, these assessment instruments enable researchers to capture student growth nested within classrooms, which provides a tool that is able to identify teacher effects on learning.  By comparing students of teachers without MSP  treatment  to students of teachers with MSP treatment in a quasi-experimental design, this research project examines the effects of teacher mathematical knowledge for teaching (MKT) growth on classroom instruction and student achievement.  The project expects to find that high teacher scores on the Learning Mathematics for Teaching (LMT) measures are correlated with the size of student gains on the new assessment instruments.  Additionally, this project adds to the suite of instruments available from the LMT for exploring the connection between teacher learning, teachers' MKT, their classroom instruction, and student outcomes.",Achievement; Area; base; Cognitive; Complex; design; Educational process of instructing; Experimental Designs; Growth; Instruction; instrument; Knowledge; Learning; Literature; Mathematics; Measurement; Measures; operation; Outcome; Research Personnel; Research Project Grants; response; Sampling; Services; Students; teacher; Testing; tool,CREATION AND DISSEMINATION OF UPPER-ELEMENTARY MATHEMATICS ASSESSMENT MODULES,NSF,NSF,5/1/2009,4/30/2012,2008,1499746.0
71,89917,"This project examines the information seeking and using behaviors of decision makers who face decisions about their future R&D investments.   A number of trends have made these decisions more uncertain, notably  Open Innovation,  the globalization of science and technology, increasingly diverse sources of technical and scientific information, as well as the global outsourcing of research to developing economies.  There is substantial evidence that industrial decision makers lack needed information; are unaware of available information; or need a more inclusive model of appropriate decision processes.  The study sheds light on whether and why industry decision makers choose global R&D over U.S. R&D.  It does this by examining how firms that are global innovators use information about scientific and technical resources, together with other innovation-related data, to shape their investment decisions and competitive strategies.  The project is based on collaboration with the Center for Innovation Management Studies and the Industrial Research Institute (IRI), whose 250 members collectively fund and conduct about 75% of U.S. industrial research. These firms' day-to-day R&D investment decisions are transforming traditional company-owned R&D laboratories into the  Laboratory of the Future  (LOF). Each firm's own  LOF  may consist of a traditional laboratory, a collaborative laboratory, a virtual laboratory or a network of external resources, including university researchers in the U.S. or abroad, as well as government or private labs, collaborative strategic partners, or simulation tools thus augmenting or even replacing company owned physical labs. LOFs are highly likely to vary by industry and by the competitive environment of the firm. The study examines participants' discussions of these decisions and the information resources they use to decide how to build their future innovation capabilities. The project analyzes the LOF discussion to reveal how R&D managers think long-term and strategically about what they do.  The project documents information seeking and information using behavior as exhibited in an on-line discussion by the decision makers about the R&D  LOF . In addition the research opens a window into decision makers' rationales for their investment commitments.Broader Impacts: Corporate R&D executives are making decisions now that will, in the aggregate, shape the LOF and affect U.S. national innovation system. This project documents how they are making those decisions, what information they are presently using, and what kinds of data might be desirable for robust decisions. The project results inform both decision makers in industry and policy makers about data and information sources presently used, not used, and data not presently available but desirable for the future.",Affect; base; Behavior; Collaborations; Data; Decision Making; Environment; Exhibits; Face; Foundations; Funding; Future; Government; Industry; Information Resources; innovation; Investments; Laboratories; Light; member; Modeling; Outsourcing; Participant; Policy Maker; Process; Research; research and development; Research Institute; Research Personnel; Resources; Science; Shapes; simulation; Source; System; Technology; tool; trend; Universities; virtual,COLLABORATIVE RESEARCH - MOD: THE R&D ''LAB'' OF THE FUTURE: FOUNDATIONS FOR MODELING THE R&D/INNOVATION PLANNING PROCESS,NSF,NSF,10/1/2008,9/30/2010,2008,155648.0
72,89912,"Sex is determined by genetic constitution (GSD) in most animals, such as by the sex chromosome pairs XX or XY in humans, or ZZ or ZW in birds.  In certain other animals, however, sex is determined by environmental temperature (TSD).   Among turtle species, however, examples of both types of sex determination can be found.  It remains unclear, however, how and why different sex determining mechanisms exist. This collaborative project will help fill this gap by comparing the chromosomes and sex-related genes of turtles using XX/XY, ZZ/ZW, or TSD mechanisms for sex determination.   Particularly, this research will test whether (1) all sex chromosomes in turtles derive from a common ancestral pair of non-sex chromosomes (or  autosomes ), and whether (2) the molecular evolution of genes located on turtle sex chromosomes differs from that of the same genes in TSD turtles, in which there are no sex chromosomes- i.e., whether the sequences of genes located on sex chromosomes change differently over evolutionary time than do the sequences of the same genes when they are located on autosomes.  This project will integrate undergraduate discovery-based learning for undergraduates into the field and lab modules of this project and will broaden the participation of underrepresented groups in biology by providing direct training opportunities for students and their mentors, by engaging women and minorities through outreach activities, and by providing further opportunities for both the investigators to serve as role models for minorities.",Animals; autosome; base; Biology; Birds; Chromosome Pairing; Constitution; Evolution; Genes; Genetic; Human; Learning; Mentors; Minority; Molecular Evolution; outreach; Research; Research Personnel; role model; sex; Sex Chromosomes; sex determination; Students; Temperature; Testing; Time; Training; Turtles; Woman,COLLABORATIVE RESEARCH: SEX CHROMOSOME EVOLUTION IN TURTLES,NSF,NSF,1/1/2009,12/31/2011,2008,439950.0
73,89911,"This project addresses a crucial area in the globalization of science: the transmission of skills to future scientists. It does this by examining doctoral training practices critical to the transmission of skills acquired through close interaction and hands-on experience, also known as 'tacit skills.' Although an under researched area in scientific training, 'tacit skills' play a crucial role in the creativity and innovation in experimental and mathematical sciences, laser and nuclear technology development. While there is a standard set of accepted scientific principles shared by most scientists, there are also differences in terms of what is learned and how it is taught. This project focuses on Japan, Singapore and Taiwan. Each of these countries has consistently exhibited high rates of innovation and productivity in recent years. However, while these countries have been successful in science education, each of them approaches the task of training scientists in various methods. The core hypothesis of the study is that student-mentor relationships significantly configure levels of scientific creativity, pioneering discoveries, technical innovation, and research productivity. The project?s main goal is to develop an empirically tested and contemporary model of science that will inform science and innovation policy about the role of 'tacit skills' in knowledge production, and to enhance best practices in U.S. graduate science training. The project analyzes the different methods using analytical, conceptual, and methodological tools from the areas of knowledge sharing, social networks, and the extended translation model of science. While a component of the project will uncover the degree of codified knowledge that is taught by most standard text books and the mastery of this knowledge, the project also seeks to understand advanced knowledge acquisition and transmission through the study of graduate science training by exploring students? relationships with mentors and peers. Contemporary research has shown that the nature of informal educational practices is not only conducive to the acquisition of 'tacit skills' but enhances professional competencies. BROADER IMPACTS: This project not only advances understanding of how 'tacit skills' are transmitted, but also informs pedagogical programs, and generates 'best practices' in advanced scientific training that recognize the changing nature and morphology of knowledge production brought about by globalization. It enhances scientific manpower and infrastructure by establishing networks of collaborations across disciplinary boundaries among scientific institutions globally. This project involves the active participation of students from underrepresented Hispanic populations located along the U.S.-Mexico border. This participation exposes and socializes these students to actual multicultural research work and to professional scientific careers critical to socioeconomic development of the U.S. southern border.",Address; Area; Asians; Books; career; Collaborations; Country; Creativeness; Development; Educational process of instructing; Exhibits; experience; Future; Goals; Hand; Hispanics; Human Resources; innovation; Institution; Japan; Knowledge; Knowledge acquisition; Lasers; Learning; Mentors; Methods; Mexico; Modeling; Morphology; Nature; Nuclear; peer; Play; Policies; Production; Productivity; programs; Research; Research Infrastructure; Role; Science; science education; Scientific Advances and Accomplishments; Scientist; Singapore; skills; Social Network; socioeconomics; Students; Taiwan; technology development; Testing; Text; tool; Training; Translations; transmission process; Work,MOD - TRANSMISSION OF TACIT SKILLS IN EAST ASIAN GRADUATE SCIENCE PROGRAMS,NSF,NSF,10/1/2008,9/30/2011,2008,385356.0
74,89910,"DRL- 0823670PI: Elisa Giaccardi ABSTRACTIn this Communicating Research to Public Audiences project, the University of Colorado at Boulder, in partnership with the University of Colorado Museum of Natural History, the City of Boulder Open Space and Mountain Parks, the CU- Boulder Office of Diversity, Equity and Community Engagement, is building on the work they have done via their NSF research award, A Meta-Design Framework for Participative Software Systems, in which they have been developing participative software systems (PPS) and applications of the software.  Community of Soundscapes will employ newly developed mobile computing and collaborative mapping technology in programs that help users gain greater insights and stake into the shared environment in which they live and visit.  Sound Camera, a digital recording device outfitted with GPS mapping software, allows users to collect audio clips of their sonic experiences as they explore their cities, parks and other environments and upload them online onto a digital map through a Web 2.0 application.  They can then compose, annotate, and share soundscapes of the places where the sounds were recorded.  A Web site will be developed to expand the project?s reach to audiences not in the Boulder programs.  Professional development training will be provided for collaborators and through the Colorado Alliance for Environmental Education.  The educational goals are to promote literacy of PSS and engage the public in personally meaningful activities that benefit environmental education (cognitive goal) and expand environmental awareness (affective goal).  The project work and its evaluation processes (by Wells Resources, Inc.) are intended to advance the field of informal science education with respect to PSS and to study how these new technologies might affect shifts in the kinds of experiences various audiences prefer to have.",Affect; Affective; Award; Awareness; Cities; Clip; Cognitive; Colorado; Communities; Computer software; design; Development; Devices; digital; Education; Environment; Evaluation; experience; Goals; insight; Internet; Life; literacy; Maps; Museums; Natural History; new technology; Process; programs; Research; Resources; science education; software systems; sound; Technology; Training; Universities; Visit; web site; Work,COMMUNITY OF SOUNDSCAPES - EXPANDING ENVIRONMENTAL AWARENESS THROUGH CAPTURE AND SHARING OF SONIC EXPERIENCES,NSF,NSF,9/1/2008,8/31/2011,2008,75000.0
75,89908,"Sex is determined by genetic constitution (GSD) in most animals, such as by the sex chromosome pairs XX or XY in humans, or ZZ or ZW in birds. In certain other animals, however, sex is determined by environmental temperature (TSD). Among turtle species, however, examples of both types of sex determination can be found. It remains unclear, however, how and why different sex determining mechanisms exist. This collaborative project will help fill this gap by comparing the chromosomes and sex-related genes of turtles using XX/XY, ZZ/ZW, or TSD mechanisms for sex determination. Particularly, this research will test whether (1) all sex chromosomes in turtles derive from a common ancestral pair of non-sex chromosomes (or  autosomes ), and whether (2) the molecular evolution of genes located on turtle sex chromosomes differs from that of the same genes in TSD turtles, in which there are no sex chromosomes- i.e., whether the sequences of genes located on sex chromosomes change differently over evolutionary time than do the sequences of the same genes when they are located on autosomes. This project will integrate undergraduate discovery-based learning for undergraduates into the field and lab modules of this project and will broaden the participation of underrepresented groups in biology by providing direct training opportunities for students and their mentors, by engaging women and minorities through outreach activities, and by providing further opportunities for both the investigators to serve as role models for minorities.",Animals; autosome; base; Biology; Birds; Chromosome Pairing; Constitution; Evolution; Genes; Genetic; Human; Learning; Mentors; Minority; Molecular Evolution; outreach; Research; Research Personnel; role model; sex; Sex Chromosomes; sex determination; Students; Temperature; Testing; Time; Training; Turtles; Woman,COLLABORATIVE RESEARCH: EVOLUTION OF SEX CHROMOSOMES IN TURTLES,NSF,NSF,1/1/2009,12/31/2011,2008,238000.0
76,90182,PHASE II: NASA TECHNOLOGY TRANSFER AND INNOVATIVE PARTNERSHIP PROGRAM The National Technology Transfer Center (NTTC) promotes technology infusion by creating awareness of technologies and areas of expertise developed in the NASA SBlR/STTR Program - and el,Area; Awareness; Infusion procedures; innovation; Phase; programs; Small Business Technology Transfer Research; Technology; Technology Transfer; United States National Aeronautics and Space Administration,PHASE II: NASA TECHNOLOGY TRANSFER AND INNOVATIVE PARTNERSHIP PROGRAM THE NATIONAL TECHNOLOGY TRANSFER CENTER (NTTC) PROMOTES TECHNOLOGY INFUSION BY CREATING AWARENESS OF TECHNOLOGIES AND AREAS OF EXPERTISE DEVELOPED IN THE NASA SBLR/STTR PROGRAM - AND EL,NASA,NASA,9/1/2008,12/31/2010,2008,2044000.0
77,89901,NASA URC SPACE CENTER CONTINUATION CALIFORNIA STATE UNIVERSITY - LOS ANGELES This proposal requests funds to continue the investigation and development of key technologies related to critical NASA missions and programs. The research and associated educati,California; Development; Funding; Investigation; Los Angeles; Mission; Postdoctoral Fellow; programs; Request for Proposals; Technology; United States National Aeronautics and Space Administration; Universities,NASA URC SPACE CENTER CONTINUATION CALIFORNIA STATE UNIVERSITY - LOS ANGELES THIS PROPOSAL REQUESTS FUNDS TO CONTINUE THE INVESTIGATION AND DEVELOPMENT OF KEY TECHNOLOGIES RELATED TO CRITICAL NASA MISSIONS AND PROGRAMS. THE RESEARCH AND ASSOCIATED EDUCATI,NASA,NASA,10/1/2008,11/30/2010,2008,2000000.0
78,89900,"CBET-0829092CannonNumerous U.S. groundwater sources host unacceptable levels of perchlorate, nitrate, chromate, vanadate, etc.  Available processes for removing these contaminants generally invoke use of petrochemical-based ion exchange media or membranes, which force municipalities and their suppliers to rely on non-renewable raw materials that are mined from non-sustainable and uncertain sources.  The investigators are targeting to devise means of employing instead lignocellulosic biomaterials (biocarbons) that originate naturally from within America.  The team will build on their recently-devised means of functionalizing the porous biocarbons with reduced-nitrogen groups that remove perchlorate and other oxyanions.  The project will link into the Sloan Fellowship program for Minority Ph.D. candidates at Penn State, which is co-led by PI Dr. Cannon.  There will also be participation in Penn State's CURO program, which facilitates minority undergraduate research.",Americas; base; Biocompatible Materials; Chromates; Doctor of Philosophy; Fellowship Program; Ion Exchange; Link; Membrane; Mining; Minority; Municipalities; Nitrates; Nitrogen; Perchlorates; Process; programs; Research; Research Personnel; Source; Vanadates; Water,"GOALI: US-NATIVE BIOMATERIALS, NITROGEN-FUNCTIONALIZED TO ADSORB PERCHLORATE AND OTHER OXYANIONS FROM WATER",NSF,NSF,10/1/2008,9/30/2012,2008,377500.0
