,PROJECT_ID,ABSTRACT,PROJECT_TERMS,PROJECT_TITLE,DEPARTMENT,AGENCY,PROJECT_START_DATE,PROJECT_END_DATE,FY,FY_TOTAL_COST
23,90101,"The  Mathematics Teacher Transformation Institutes  (MTTI) project is a research-based investigation of how leadership emerges and is expressed through mathematics knowledge, student-focused instructional practices, and influences on schools' mathematics outcomes.  In particular, this research is broadening the knowledge base on teaching and learning in mathematics through new understanding of how the study of conceptually-challenging mathematics, particularly in algebra and geometry, benefits second-stage teachers (4-10 years' experience); of how classroom-based action research contributes to critical and analytical understanding of the relationships between teaching practices and student learning; and of how multi-levels of support prepare second-stage teachers for leadership roles. To achieve these research objectives, the City University of New York (CUNY), Herbert H. Lehman College is partnering with New York City Department of Education Districts 7, 8, 9, 10, 11, and 12.  Lehman College faculty in mathematics and mathematics education, staff of education centers and institutes who work in Bronx schools, and the Superintendents of Bronx districts work together to engage 80 experienced middle or high school teachers in the Bronx in 330 hours of professional development over 3 years to strengthen their leadership abilities, mathematics abilities, and educational practices.  These MTTI teacher participants are further supported on-site at their schools and through on-line discussion forums and are provided opportunities to showcase their work.  MTTI cultivates a professional network of mathematics teacher leaders who provide leadership to 200 additional middle and high school mathematics teachers as they enact a variety of roles including mentor, peer coach, presenter, conference participant/speaker, and active member of school curriculum and professional development teams.  Additionally, they participate in local and national discussions of current policy, practice, and research, and they develop informed understandings of the strengths and challenges of culturally and linguistically diverse classes.  Upon completion of the Institute, participants receive a Certificate for Secondary-School Mathematics Specialists through CUNY's School of Professional Studies of the Graduate School and University Center, registered with New York State Education Department.",Action Research; base; Cities; college; Development; Education; Educational Curriculum; Educational process of instructing; experience; Faculty; high school; Hour; Institutes; Investigation; Knowledge; knowledge base; Leadership; Learning; Mathematics; member; Mentors; New York; New York City; Outcome; Participant; peer; Policies; Research; Role; School Teachers; Schools; Secondary Schools; Site; Specialist; Staging; Students; symposium; teacher; Universities; Work,MATHEMATICS TEACHER TRANSFORMATION INSTITUTES,NSF,NSF,10/1/2008,9/30/2013,2008,4051562.0
24,90102,"Arizona State University (ASU) in collaboration with Phoenix Union High School District, Scottsdale Union High School District, Roosevelt District, Boys and Girls Club of the East Valley-Sacaton, Intel, Applied Learning Technologies Institute, Dynamic Educational Leadership for Teachers and Administrators (D.E.L.T.A.), ASU's School of Computing & Informatics, ASU's Video Game Design Camp, and Arizona Council of Black Engineers and Scientists Computer Camp (ACBES), are conducting a culturally relevant multimedia program strategy, COMPUGIRLS. Drawing on three well-documented frameworks, Culturally Relevant Pedagogical practices (CRP), Social Justice Youth Development Framework, and Future Time Perspective, this after-school and summer program fosters in IT/STEM related outcomes for 100 adolescent (grades 8-12) girls from several Phoenix high needs districts and schools. COMPUGIRLS takes place at two sites, ASU and the Boys and Girls Club of the East Valley-Sacaton. Already, 40 girls have completed one-year of the program. This project expands the program to include another 60 students, their parents, ASU graduate students and in-service teachers, and peer mentors. COMPUGIRLS provides hands-on technology experiences that include internships, Advanced Placement credit, conference and community presentations, and parent workshops that will ultimately develop participants' techno-social analytic skills for real world problems.As part of their experience, students visit ASU. For many, this is the first time they have been on a college campus. Students participate in 6 multimedia courses: 1) social justice and the media, 2) SCRATCH, user-friendly computer programming, 3) modding SIMS, designing, modifying, and troubleshooting simplified simulations, 4) choice of 3-D, programming, and character design, 5) advanced choice of 3-D, programming, and character design, and 6) teamwork to create neighborhoods in Sim City using all skills learned. Participants' projects will be disseminated semi-annually through community ceremonies, web pages, and presentations.The project builds upon a pilot program (Summer 2007 to present) that accommodated 40 girls from under-resourced districts in the Phoenix metro area. The COMPUGIRLS program is a two-year curriculum using multimedia activities as a means of encouraging computational thinking. The project advances understanding of how to encourage girls (including girls from underrepresented groups) to pursue ICT fields. It builds upon established research and includes evaluation of the impact on participants' computational thinking, techno-social analytical skills, attitudes about and interest in pursuing further education and careers in ICT/STEM fields. The goals are:1) To use multimedia activities as a means of encouraging computational thinking; 2) To enhance girls' techno-social analytical skills; and 3) To provide the building blocks for Arizona girls from underrepresented groups to successfully traverse an ICT and/or any work force roadmap. The evaluation of the project consists of a mixed-methods approach (qualitative and quantitative), incorporating the use of survey instruments, student journals, focus groups, interviews, document review, observation and an intensive case study. A comparison/control group is incorporated into the pre- and post-test design to determine the extent the participants' skills, knowledge, attitudes and behaviors changed relative to where they would have been without participation in the project.","3-Dimensional; Administrator; Adolescent; Area; Arizona; Attitude; behavior change; boys; Build-it; Camping; career; Case Study; Cities; Collaborations; college; Communities; Computers; Control Groups; design; Development; Education; Educational Curriculum; Educational workshop; Engineering; Evaluation; experience; Focus Groups; Fostering; Future; girls; Goals; graduate student; Group Interviews; Hand; Health Knowledge, Attitudes, Practice; high school; Impact evaluation; Informatics; Institutes; interest; Internships; Journals; Leadership; Learning; Mentors; Methods; Multimedia; Neighborhoods; Outcome; Parents; Participant; peer; Pre-Post Tests; programs; Relative (related person); Research; Schools; Scientist; Services; simulation; Site; skills; social; Social Justice; Students; Surveys; symposium; teacher; Technology; Time; Universities; user-friendly; Video Games; Visit; web page; Work; Youth",COMPUGIRLS: A CULTURALLY RELEVANT TECHNOLOGY PROGRAM FOR GIRLS,NSF,NSF,9/15/2008,8/31/2012,2008,879425.0
25,90103,"In most areas of human knowledge, the information revolution has resulted in a massive data explosion. The scale of data sets, their distributed and heterogeneous nature, and the need to quickly deliver results easily interpretable by non-experts, raise new theoretical and computational challenges for statistical learning, from variable selection and structural inference to visualization and online learning. This project uses sparse statistical inference as a powerful approach to meet these challenges. Its key insight is that seeking sparsity is a meaningful way of simultaneously stabilizing inference procedures, and highlighting structure in the underlying data. This work thus combines fundamental advances in sparse statistical learning with cutting-edge computational tools from mathematical programming to create a new framework for structural knowledge discovery in large-scale, streaming data sets. It is focused on two fundamental themes in sparse inference: variable selection and structural inference. Variable selection seeks to isolate a few key variables from high dimensional data sets and is a fundamental preprocessing tool in statistical learning. Structural inference then aims to consistently identify a few core dependence relationships among these variables to highlight its structure. From a computational point of view, many recent results in machine learning have relied on advanced methods from convex optimization such as semidefinite programming and robust optimization and this project seeks to improve the complexity of these algorithms and their capacity to handle very-large scale, streaming data.  In practice, this project is motivated by the desire to help the public understand our democracies by analyzing large-scale political and social data sets, with a particular focus on voting records, online news sources, and polling data. Its approach is to apply statistical inference principles to social sciences, using collaborations with experts in political science and economics to forge the models and techniques under study. In carrying out the research, this project will be training graduate students from statistics, electrical engineering/financial engineering into interdisciplinary researchers at the interface of statistics, optimization, and subject matter areas such as finance and political science. In addition we plan to develop a web site, accessible first to a restricted set of social science researchers, to allow them to analyze mid-sized corpora of online news in text format, in the form of say, sparse graphs of words showing statistical associations between given keywords. The PIs plan to develop a software toolbox implementing these results, interfaced with common numerical packages such as MATLAB, R or python as well as an undergraduate course on ``Statistical Analysis of Online Data  at Berkeley and Princeton, incorporating some of the material produced in this project into the course program.",Algorithms; Area; Collaborations; Computer software; computerized tools; Data; Data Set; Democracy; Dependence; Economics; Electrical Engineering; Engineering; Explosion; forging; graduate student; Graph; Human; Imagery; improved; insight; Knowledge; Knowledge Discovery; Learning; Machine Learning; meetings; Methods; Modeling; Nature; news; Procedures; programs; Pythons; Records; Research; Research Personnel; Research Project Grants; Science; social; Social Sciences; Source; statistics; Stream; Structure; Techniques; Text; tool; Training; Voting; web site; Work,CDI TYPE II: COLLABORATIVE RESEARCH: SPARSE INFERENCE: NEW TOOLS FOR STRUCTURAL KNOWLEDGE DISCOVERY,NSF,NSF,9/15/2008,2/28/2013,2008,1341676.0
26,90106,"Lead Partner:  Michigan Technological UniversityCore Partner: Grand Rapids Public Schools (GRPS)Supporting Partners: Grand Rapids Area Pre-College Engineering Program (GRAPCEP), Midwest National Parks, Cass Technical High School, American Geological Institute, Grand Valley State University Geology Department, Kalamazoo Area Mathematics and Science Center   Michigan Teaching Excellence Program (MITEP) is a multi-year program of teacher leadership development that empowers middle-grade science teachers to lead their schools and districts through the process of systematically improving science teaching and learning. The project uses Earth Systems Science(ESS)content and inquiry-based instructional practices to emphasize themes that unite all sciences and mathematics. MITEP includes both summer and academic-year components, and uses a variety of on-site, residential, field, distance, and in-service delivery methods. Components promote leadership skills, collaboration, urban place-based inquiry, access to cutting-edge data and materials, technology, engagement of diverse learners, study of key scientific concepts that cross disciplinary boundaries, pedagogical innovation. The project will also implement and test lessons and units that challenge students and prepare them for further science study. Teachers receive stipends and credit as incentive for participating in the project and testing its approach to reform.    The project is based on the premise that successful reform depends on the full involvement of teachers who have the skills to lead their colleagues through the process of developing and implementing new instructional approaches. MITEP teacher-leaders and research university faculty are full partners in the process. Teacher-leaders are at the forefront of their schools' and district's efforts to evaluate, design, implement, and test new inquiry-based instructional programs. MITEP teacher-leaders help develop common pacing schedules and  course assessments. They assist with planning  professional development activities and providing ongoing assistance to colleagues. MITEP teacher-leaders are encouraged to disseminate information about the project through presentations at state and national conferences, to submit papers for publication.     Teacher-led reform is strongly supported by the administration of the core school district partner as an innovative way to generate enthusiasm for curricular and instructional change. To encourage development of leadership skills, school administrators give teacher-leaders progressively increased responsibility for strengthening curriculum, improving instructional strategies, and designing assessments. District administrators are providing the resources required for teachers' success in implementing and coordinating the project by assisting with the selection of teachers with exceptional leadership qualities for participation in MITEP;assisting in the design of professional development activities that meet the needs of teachers and their students; providing flexibility in teachers' schedules; utilizing middle-grade teachers' expertise in the dissemination of information to primary and high-school teachers; recognizing, rewarding, and encouraging teachers who serve as leaders; fostering growth of a teacher network; and creating a district-wide atmosphere that nurtures teacher-led reform efforts.",Administrator; American; Area; base; Collaborations; college; Data; design; Development; Educational Curriculum; Educational process of instructing; empowered; Engineering; Faculty; flexibility; Fostering; Geology; Growth; high school; improved; Incentives; Information Dissemination; innovation; Institutes; Lead; Leadership; Learning; Mathematics; meetings; Methods; Michigan; Modeling; Paper; planetary Atmosphere; Process; programs; Publications; Research; Resources; Rewards; Schedule; School Teachers; Schools; Science; science education; Services; Site; skills; Students; success; symposium; System; teacher; Technology; Testing; Universities,MICHIGAN TEACHER EXCELLENCE PROGRAM (MITEP): A MODEL FOR IMPROVING EARTH SCIENCE EDUCATION NATIONWIDE,NSF,NSF,1/1/2009,12/31/2012,2008,3311435.0
27,89960,IMPACT MECHANICS AND CENTRAL PIT FORMATION ON ICY SATELLITES Central pit craters are an unusual morphological class of impact crater seen most commonly on the large icy satellites Ganymede and Callisto where they replace the peak-ring morphology expected,Ganymede; Mechanics; Morphology,IMPACT MECHANICS AND CENTRAL PIT FORMATION ON ICY SATELLITES CENTRAL PIT CRATERS ARE AN UNUSUAL MORPHOLOGICAL CLASS OF IMPACT CRATER SEEN MOST COMMONLY ON THE LARGE ICY SATELLITES GANYMEDE AND CALLISTO WHERE THEY REPLACE THE PEAK-RING MORPHOLOGY EXPECTED,NASA,NASA,9/17/2008,9/16/2012,2008,188920.0
28,89958,"The number of scientific journals and the number of papers published in those journals is increasing at a fast pace: currently, there are roughly 9,000 scientific journals, a twenty-fold increase from the 400 scientific journals available in 1955. The size and growth of the research literature places a tremendous burden on decision-making agents, such as funding agencies, university administrators, and reviewers, who have to evaluate the quality of research of individuals and institutions in a fast and efficient manner. In addition, the evaluation of individuals and institutions relies heavily on the assessment of the ultimate impact of published research, typically measured as the number of publications or the number of citations. Despite the oversimplification of using just a few numbers to quantify the scientific merit of a body of research, the entire science and technology community is relying more and more on citation-based statistics as a tool for evaluating the research performance of individuals and institutions and the development of tools that facilitate the evaluation task is crucial in order to ensure the highest quality standard for funded research.A major challenge is that stakeholders often want an estimate of the impact of a paper long before citations start to accumulate. This project aims precisely at facilitating such a task by developing tools to predict, soon after publication, the ultimate impact of research. This project uses longitudinal data available for papers published since 1955, drawing upon the concept that one can infer patterns of citation accumulation from large-scale analysis of historical data. Broader Impact: The outcome of this research is of relevance to decision makers that are called on to evaluate the productivity of researchers and institutions, as well as the impact of their work. The goal of this project is to develop transparent statistically-sound methods in order to enable institutions and funding agencies to make better informed decisions based on an objective assessment of the impact of published research.",Administrator; base; Communities; Data; Decision Making; Ensure; Evaluation; Funding; Funding Agency; Goals; Growth; Individual; Institution; Journals; Literature; Measures; Methods; Modeling; Outcomes Research; Paper; Pattern; Performance; Productivity; Publications; Publishing; Research; Research Personnel; Science; sound; statistics; Technology; tool; tool development; Universities; Work,TLS: EARLY PREDICTION OF THE IMPACT OF RESEARCH THROUGH LARGE-SCALE ANALYSIS AND MODELING CITATION DYNAMICS,NSF,NSF,10/1/2008,9/30/2011,2008,450817.0
29,90112,IMPROVED NUMERICAL MODELING OF GAS-SURFACE INTERACTION IN HYPERSONIC FLOWS  A modification to the NASA DPLR code is proposed to improve the capability of the tool to simulate detailed gas/surface interaction chemistry on TPS materials for applications to,Chemistry; Code; Gases; improved; Modeling; Modification; Simulate; Surface; tool; United States National Aeronautics and Space Administration,IMPROVED NUMERICAL MODELING OF GAS-SURFACE INTERACTION IN HYPERSONIC FLOWS A MODIFICATION TO THE NASA DPLR CODE IS PROPOSED TO IMPROVE THE CAPABILITY OF THE TOOL TO SIMULATE DETAILED GAS/SURFACE INTERACTION CHEMISTRY ON TPS MATERIALS FOR APPLICATIONS TO,NASA,NASA,8/1/2008,11/2/2009,2008,38591.0
30,90115,"The Kentucky (KY) EPSCoR RII-7 proposal unites eight institutions, University of Kentucky, Berea College, Centre College of Kentucky, Kentucky State University, Morehead State University, Northern Kentucky University, University of Louisville, and Eastern Kentucky University, to continue the strategy of investing in infrastructure to develop Kentucky?s ?New Economy? by supporting research in Innovative Materials and Devices.  Intellectual Merit This project will pursue two major research initiatives. Initiative in Innovative Materials and Devices is focused on studies of bulk single-crystal transition metal oxides and epitaxial thin films with complementary functionalities, and applications of multilayered thin films for molecular electrodes as well as for single-molecule magnets. The other part of the project will focus on engineering new platforms to enhance our understanding of a single cell or multiple cell types, interactions between individual cells and cell types, and sensing at the molecular, intracellular and intercellular levels. A statewide Micro/Nano Network will advance micro/nanotechnology and the many fields that utilize this technology.Broader ImpactsKentucky EPSCoR has developed a comprehensive plan for increasing diversity and evaluating progress in that area.  Programs such as seed-funding that supports research at regional institutions and a program to involve diverse populations of Kentucky students in research will be supported through EPSCoR.  A special program for computer science graduate students at Kentucky State University will be introduced.  Kentucky EPSCoR also proposes the cyberinfrastructure plans for the state, and augments them with support for increasing the expertise and developing new sources of talent. The project is consistent with the state?s science and technology plan, and the associated higher education plan.  The project will develop new facilities and establish new faculty and staff positions in the bio-, nano-, & cyber-technology areas.  Kentucky EPSCoR has developed a review process intended to identify infrastructure that should support the most promising research.  A system of evaluation metrics has been developed to determine whether a strategy is working, and if it is improving Kentucky?s competitiveness.",Area; cell type; Cells; college; computer science; Devices; education planning; Electrodes; Engineering; Evaluation; Faculty; Film; Funding; graduate student; improved; Individual; innovation; Institution; Kentucky; metal oxide; Metric; Molecular; molecular film; nano; Nanotechnology; Population Heterogeneity; Positioning Attribute; Process; programs; Research; Research Infrastructure; Research Support; Science; Seeds; single molecule; Source; Students; System; Talents; Technology; Transition Elements; Universities; Work,TRANSFORMING KENTUCKY''S NEW ECONOMY,NSF,NSF,9/1/2008,8/31/2013,2008,7421000.0
31,90117,"The Milwaukee Mathematics Partnership (MMP) began in 2003 with the aim of improving mathematics achievement for the students in the Milwaukee Public Schools and increasing students' success in transitioning to college mathematics. The University of Wisconsin-Milwaukee, the Milwaukee Public Schools, and the Milwaukee Area Technical College have solidified their continued commitment as core partners to this unique collaboration among a large urban district, a four-year urban university, and a two-year technical college. Student achievement has increased in most grade levels with an accompanying decrease in the gap between state and district proficiency. Evaluations indicate that building school capacity through a math framework and distributed leadership via school learning teams and math teacher leaders is associated with improved student achievement.Phase II will investigate three specific research topics. The first topic involves continued study of the impact of distributed leadership through varied mathematics teacher leader models on school professional communities and on student achievement. The MMP initiated a no-release time model of teacher leaders and is transitioning to a partial-release time model with funds from the Office of the Wisconsin Governor. A second area of research is the transition of students to post-secondary mathematics. The MMP will study the impact of a new district post-secondary mathematics readiness exam on high school course enrollments and post-secondary placements into remedial and non-remedial courses. The third area is focuses on the development of mathematical knowledge for teaching in preservice teachers, teacher leaders, and classroom teachers and will examine the relationship of this knowledge to teacher leader practice, instructional practice, and student learning.",Achievement; Area; Collaborations; college; Communities; Development; Educational process of instructing; Enrollment; Evaluation; Funding; high school; improved; Knowledge; Leadership; Learning; Mathematics; Modeling; Phase; Readiness; Research; Schools; Students; success; teacher; Time; Universities; Wisconsin,MILWAUKEE MATHEMATICS PARTNERSHIP PHASE II: SHARING IN LEADERSHIP FOR STUDENT SUCCESS,NSF,NSF,1/1/2009,12/31/2012,2008,2099988.0
