,PROJECT_ID,ABSTRACT,PROJECT_TERMS,PROJECT_TITLE,DEPARTMENT,AGENCY,PROJECT_START_DATE,PROJECT_END_DATE,FY,FY_TOTAL_COST
71,89839,"Collaborative Research: Time-Dependent Hydrothermal Convection within the Great Basin, NevadaIs groundwater flow restricted  to  high permeability  fault planes driven by free-convection?  Or, is flow driven by water-table topographic gradients  with some combination of matrix and fault controlled fluid circulation? Are these systems fundamentally transient and self-sealing due to gaunge mineralization, or , is permeability enhanced by  carbonate dissolution? To evaluate these problems we will develop a suite of 3D, single-phase, hydrothermal models using a new parallel finite element code (PGEOFE) for two field sites within the Great Basin.  We will utilize a new three-dimensional (3-D) geologic model of  the  modern Beowawe geothermal system and, with USGS colleagues, develop another 3-D geologic model of the Eocene  Carlin system; two sites with rich , isotopic, geochemical and geothermal data sets. Using LaGrit mesh generation software, these hydrogeologic models will honor known fault geometries, widths, and  stratigraphy. This mesh generation software will allow us to honor low grid aspect ratios (required by the AZTEC parallel solver package)  as the grid transitions from strata to faults while allowing sufficient refinement to minimize numerical grid dispersion when solving the heat and mass transport equations.  We will use multiple constraints including temperature profiles, shallow heat flow maps, fluid/rock ä 18O composition, and the age of hot springs deposits to constrain our models. At Beowawe, by dating pollen in the sinter terrace and adualria in exposed veins nearby we can get a sense of the timing of episodic discharges of hot fluid up the faults and on the duration of such discharges recorded by the sinter deposits. More sophisticated reactive-transport geochemical models will be developed using PFLOTRAN  to evaluate porosity-enhancing carbonate dissolution reactions and ?sealing gangue precipitation reactions in each system. Our models will be validated by comparing modern and fossil geochemical and thermal proxies . The project will support two graduate students at New Mexico Tech and University of Missouri at Columbia. Initial results will be presented to industry representatives from Beowawe power plant, Barrick and Newmont gold mines for their input and feedback to improve the final result. Results will be published at the Geological Society of Nevada 2010 symposium and scientific journals to reach local and international audiences.",3-Dimensional; Age; Blood Circulation; Carbonates; Code; Computer software; Convection; Data Set; Deposition; Elements; Equation; Feedback; Fossils; Generations; Gold; graduate student; Heating; Hot Springs; improved; Industry; International; Journals; Liquid substance; Maps; mineralization; Mining; Missouri; Modeling; Nevada; New Mexico; Permeability; Phase; Pollen; Porosity; Power Plants; Precipitation; Proxy; Publishing; Reaction; Research; seal; Site; Societies; symposium; System; Temperature; Time; Universities; Veins; Water; Width,"COLLABORATIVE RESEARCH: TIME-DEPENDENT HYDROTHERMAL CONVECTION WITHIN THE GREAT BASIN, NEVADA",NSF,NSF,10/1/2008,9/30/2010,2008,58413.0
72,89836,THERMOREGULATORY CAPACITY LIND EXERCISE RESPONSES FOLLOWING PROLONGED LUNAR ANALOG BED REST -Impaired exercise-thermoregulation and altered cardiovascular responses to exercise (i.e. - reduced work capacity / elevated heart rate for a given exercise workl,analog; Bed rest; Cardiovascular system; Exercise; Heart Rate; Physiologic Thermoregulation; response; Work,THERMOREGULATORY CAPACITY LIND EXERCISE RESPONSES FOLLOWING PROLONGED LUNAR ANALOG BED REST -IMPAIRED EXERCISE-THERMOREGULATION AND ALTERED CARDIOVASCULAR RESPONSES TO EXERCISE (I.E. - REDUCED WORK CAPACITY / ELEVATED HEART RATE FOR A GIVEN EXERCISE WORKL,NASA,NASA,10/1/2008,9/30/2011,2008,224877.0
73,89834,"ABSTRACT: Studying the contributions of U.S. universities to the innovation process and National Income is important to understanding how our current economic status has been achieved and to how our international competitiveness may be maintained or increased. This project models a key component of the innovation system, particularly creation and deployment of knowledge and the flows of financial resources. The objectives of this work are to produce estimates of the contributions of various combinations of university resources, especially those of STEM units, to outcomes that represent intermediate steps in the innovation process and that contribute to NI and thus to U.S. competitiveness.The key insight of the project is that universities produce multiple outputs--for example supplies of highly skilled labor and new knowledge. The importance of this labor and technological development to the national economy has been well established in both classical and evolutionary economic theory.  In addition, universities serve as support institutions for firms and industries. Universities contribute to intermediate outcomes that stimulate innovation processes and fuel the national economy. The primary emphasis is to use data to develop new models explaining the relationships among resource deployment in U. S. universities and intermediate (to National Income growth) university outcomes, particularly in science, technology, engineering and mathematics (STEM).  These are outcomes that are important to U.S. economic growth and ultimately to international competitiveness and hence the models can be used to inform science and technology investment decisions.The project builds a relational meta data base that examines the relationships among resource deployment in U.S. universities and intermediate university outcomes related to innovation and economic growth. The data for the project are derived from a variety of sources at the institutional, departmental, and individual levels. Intermediate and final outcomes include wages paid, the production of graduates, patents, licenses, start-up and spin-off companies, consultancies, joint industry-university grants and contracts, job-training programs for firms? employees, and importantly, research papers. ?Inputs? related to these outcomes include various university resources: e.g., the human resources of university faculty, staff, and student workers; the time allocations of these individuals across teaching, research and service; and the allocation of the university?s own financial resources. BROADER IMPACTS: The benefits include advancing understanding of the relationships among resource deployment in U. S. universities and intermediate university outcomes in STEM fields. These are outcomes that are important to U.S. economic growth and ultimately to international competitiveness. Thus, the models can be used to inform science and technology investment decisions.",Contracts; Data; Databases; Development; Economics; Educational process of instructing; Employee; Engineering; Faculty; Grant; Growth; Human Resources; Income; Individual; Industry; innovation; insight; Institution; International; Investments; Joints; Knowledge; Legal patent; Licensing; Mathematics; Modeling; Occupations; Outcome; Output; Paper; Process; Production; Research; Resources; Science; Services; Source; Students; System; Technology; theories; Time; Training Programs; Universities; Wages; Work,"UNIVERSITIES, INNOVATION AND ECONOMIC GROWTH (MOD)",NSF,NSF,10/1/2008,9/30/2012,2008,404999.0
74,89833,"Sulfur is an essential element in proteins, lipids, and some critical metabolites. The work proposed in this grant continues an exploration of the regulatory aspects of sulfur deprivation responses in the alga Chlamydomonas. Regulatory mutants aberrant for sulfur-deprivation responses and suppressor strains will be characterized to help identify interactions among signaling factors. Wild-type and various mutant strains will be queried with genome-wide methods for examining the transcriptome under nutrient-replete and sulfur-starvation conditions, using both microarray and Solexa sequencing technologies. Focused intellectual and technical efforts will be directed toward establishing more biochemical links between identified regulators. A diversity of protein-protein interaction assays, including the yeast two-hybrid system, the split ubiquitin and split GFP systems and the classical co-immunoprecipitation assays will facilitate these studies, providing strong insights into the regulatory circuits that control nutrient limitation responses in photosynthetic organisms. Finally, analyses will be performed to help understand the two tiers of the sulfur-deprivation response that have recently been discovered; one is protein synthesis-independent while the other is protein synthesis-dependent. In a broader sense, the proposed work will help untangle some of the complexities associated with the regulatory machinery that is required for photosynthetic cells to cope with deprivation conditions and ultimately help us understand the impact of sulfur compounds in our diets and on global weather patterns; some sulfur compounds strongly influence the quality and nutritional value of food while others have profound effects on the climate of the Earth. The project will train a post doctoral student and will involve collaboration with Dr. Charles Hauser and his undergraduate students at St. Edward's University, who will participate in summer exchange and in the analysis of microarray results. St. Edward's University is a minority serving institution.",Algae; Biochemical; Biological Assay; Cells; Chlamydomonas; Climate; Co-Immunoprecipitations; Collaborations; coping; deprivation; Diet; Food; Gene Expression Profile; Genetic; genome-wide; Genomics; Grant; Indium; insight; Link; Lipids; Methods; Microarray Analysis; Minority-Serving Institution; mutant; Nutrient; Nutritional; Organism; Postdoctoral Fellow; Protein Biosynthesis; protein protein interaction; Proteins; response; Signal Transduction; Starvation; Students; Sulfur; Sulfur Compounds; System; Technology; Training; Ubiquitin; Universities; weather patterns; Work; yeast two hybrid system,"GENETIC, GENOMIC, AND BIOCHEMICAL APPROACHES TO ELUCIDATE CONTROL OF SULFUR DEPRIVATION RESPONSES",NSF,NSF,10/1/2008,9/30/2012,2008,448708.0
75,90259,"Understanding the sensitivity of food systems to global change is limited by high uncertainties associated with the cross-scale interactions between the natural environment and the cultural landscape. Defining what might be within a suite of plausible futures requires a baseline scenario that captures the factors that are most significant in shaping decisions at different levels of governance, and which highlights the current, changing and interacting sensitivities of the system to stressors associated with both climate change and economic and cultural globalization. This project will create such a baseline by assessing the drivers and evolving social outcomes of one of the world's most important food systems: the Mexican maize system. Building on prior research that anticipates climate change will have negative impacts for Mexican maize production, and the globalization of agricultural markets is further challenging the future of maize in Mexico, an interdisciplinary team of social and biophysical scientists will investigate Mexican agricultural vulnerability in terms of a complex food system, in which individual decisions to plant or not to plant maize are hypothesized to manifest as landscape scale transformations. The research team also expects that global to regional price signals and climatic variability will affect local food production and land use outcomes differently across the Mexican landscape, as a function of regionally-specific cultural, economic, demographic, ecological and political factors. The project involves: a) a description of the changing national geography of maize production and the associated socioeconomic, institutional, and demographic correlates; b) an analysis of climate trends and variability as related to maize production, yields and water availability for irrigated farming; c) an econometric analysis of the spatial patterns of maize price volatility in three maize-producing states in order to evaluate the contribution of maize price volatility to farm-level risk and d) an evaluation of the drivers (e.g., prices and climate) and outcomes (land use, perceptions of food quality, and household maize expenditures) of maize abandonment / persistence at the farm-level through case studies in the states of Sinaloa, Mexico and Chiapas. A combination of approaches will be used, including exploratory spatial data analysis (ESDA), econometrics analysis (spatial, time-series, and spatial panels), agro-climatic analyses, and household livelihood surveys.This interdisciplinary and multi-method project involves experts in economic geography, econometrics, spatial analysis, livelihood assessment, climatology, agroecology and public policy in Mexico and the United States. It will provide the foundation for subsequent research on the development of scenarios of future social-ecological change and vulnerability of food security in Mexico. The project consolidates a strong international collaborative research community, involving Arizona State University, University of California Santa Barbara, the Colegio de Mexico (Mexico City), the Colegio de la Frontera Sur (Chiapas), and the National Institute of Forestry, Agriculture and Livestock Research (INIFAP, Mexico City). The project aims to enhance this network throughout the project's implementation, by inviting Mexican experts external to the project to participate in part of the annual project coordination meetings to share their research and insights. Graduate students from the U.S. institutions will collaborate with research counterparts in Mexico. The approaches and findings from the project will be used as case material for graduate and undergraduate courses in earth system science, regional analysis, development economics and sustainable food systems. The diagnostic and analytical results of this project will be disseminated through a variety of forums to maize policy experts of the national agricultural secretary (SAGARPA), state agriculture ministries in Sinaloa, State of Mexico and Chiapas, non-governmental organizations interested in land use change and maize diversity, and to the academic communities in Mexico and the U.S. The project's results will also be disseminated to Mexican authorities responsible for climate change initiatives nationally in order to contribute to the efforts of these agencies to comply with international climate change agendas.",Affect; Agriculture; Arizona; authority; California; Case Study; Cities; Climate; climate change; Communities; Complex; Data Analyses; Development; Diagnostic; Ecological Change; Economic Development; Economics; Environment; Evaluation; Expenditure; Farming environment; Food; food quality; food security; Forestry; Foundations; Future; Geography; Global Change; graduate student; Household; Individual; insight; Institutes; Institution; interest; International; land use; Livestock; Maize; Marketing; meetings; Methods; Mexican; Mexico; Outcome; Pattern; Perception; Plants; Policies; Political Factor; Price; Production; Public Policy; Research; Risk; Science; Scientist; Series; Shapes; Signal Transduction; social; socioeconomics; stressor; Surveys; System; Time; trend; Uncertainty; United States; Universities; Water,HSD: MARKET INTEGRATION AND CLIMATE AS DRIVERS OF CHANGE IN THE MEXICAN MAIZE SYSTEM: MULTI-SCALE INTERACTIONS IN LIVELIHOOD AND LAND-USE CHANGE,NSF,NSF,9/15/2008,2/29/2012,2008,627316.0
76,90263,ADVANCES IN PHOTOMETRIC PRECISION FOR ALL-SKY EXOPLANET SURVEYS SUMMARY: MIT / Harvard-Smithsonian / Google / and NASA ARC are partners in a new initiative to discover more than 1000 new transiting exoplanets including several exoplanets comparable in siz,Surveys; United States National Aeronautics and Space Administration,ADVANCES IN PHOTOMETRIC PRECISION FOR ALL-SKY EXOPLANET SURVEYS SUMMARY: MIT / HARVARD-SMITHSONIAN / GOOGLE / AND NASA ARC ARE PARTNERS IN A NEW INITIATIVE TO DISCOVER MORE THAN 1000 NEW TRANSITING EXOPLANETS INCLUDING SEVERAL EXOPLANETS COMPARABLE IN SIZ,NASA,NASA,9/4/2008,4/22/2010,2008,124999.0
77,89830,"This project focuses on the study of DNA-protein complexes through single-DNA micromanipulation. Using magnetic tweezers and micropipette manipulation of DNAs attached to micron-sized particles, the dynamics of formation, mechanical properties, and catalytic function of nucleoprotein complexes will be measured. Self-assembly, activities and disassembly of these protein-DNA complexes will be studied via precise time-resolved measurement of mechanical properties, i.e. molecular lengths as a function of applied force. This simple yet versatile approach allows observation of kinetics of reactions as well as equilibrium states, for proteins that reorganize DNA structure. The project will also include development of transverse magnetic tweezer methods, including techniques for experiments on two DNA segments at once. Broader impacts of this research will be via its highly interdisciplinary nature, and by development of new biophysical techniques (transverse magnetic tweezer and combined magnetic tweezer/micropipette methods) for study of DNA-protein interactions. Along with this, the proposed activities will focus on research education for Ph.D. and postdoctoral students, combining physics and biology. Funding for this award is provided by the Division of Physics and the Office of Multidisciplinary Activities in the Mathematical and Physical Sciences Directorate and by the Division of Molecular and Cellular Biosciences in the Biosciences Directorate.",Award; Biology; Complex; Development; DNA; DNA Structure; DNA-Protein Interaction; Doctor of Philosophy; Education; Equilibrium; Funding; Kinetics; Length; Magnetism; Measurement; Measures; Mechanics; Methods; Micromanipulation; Molecular; molecular mechanics; multidisciplinary; Nature; Nucleoproteins; Particle Size; physical science; Physics; Property; protein complex; Proteins; Reaction; Research; research study; self assembly; self organization; Students; Techniques; Time,"SELF-ORGANIZATION, MOLECULAR MECHANICS, AND CATALYTIC FUNCTIONS OF NUCLEOPROTEIN COMPLEXES STUDIED USING SINGLE-DNA MICROMANIPULATION",NSF,NSF,5/1/2008,4/30/2011,2008,319753.0
78,89825,"Intelligent Merit: This study will examine and clarify for policymakers and researchers the impact of statewide policy changes that increased the availability of advanced STEM courses for a greater number of schools and students.  The proposer will analyze the extent to which the policy changes affect outcomes for all students, particularly students who are underrepresented in STEM areas.  This study, then, will provide critical information about the effectiveness of policy changes for stakeholders who have a vested interest in understanding the effects of advanced curricular programs on student enrollment in STEM courses during high school and early college.  The project will address two key research questions: 1. Who enrolls in accelerated academic programs?  What are the factors (the student and school) that influence enrollment in different accelerated and non-accelerated curricular programs? 2. Do accelerated academic programs increase students? STEM coursetaking in high school and during their first year of postsecondary school (Grade 13)?  Do some programs increase STEM coursetaking more than others?  Do these programs reduce gaps in STEM coursetaking among historically underrepresented students and their peers?The proposer will use a mixed method approach to address the research questions that includes a quantitative analysis of extant longitudinal data in the state of Florida and a qualitative assessment of non-statistical factors through site visits to schools.  Ten years of quantitative data from the Florida Department of Education (FLDOE) will serve as the main source of information the proposer will use to study the characteristics of both students and schools.  The FLDOE dataset includes a rich array of high school and postsecondary data (e.g. transcripts; dual enrollment and achievement data in these courses; regular 1-12 grades school test scores; demographic data; poverty index information).  Two sets of school site visits will be conducted in the state?s major urban centers as well as small suburban high schools to provide insights not captured through quantitative analysis.  During the initial visits, data will be collected via course catalogs and interviews with school personnel.  For follow-up visits, data will be collected through student focus groups about all aspects of course offerings and course taking.  Broader Impacts: Contribution to the field of knowledge about student enrollment in advanced STEM coursework will likely advance discovery in this area.  The extensiveness of the work (examination of student and school factors from high school to college in mathematics and science) increases the importance of results to local and national policymakers and researchers. The wide range of expertise (individuals and institutions) adds significantly to the strength of the proposal and increases the credibility of expected outcomes.  Lessons-learned from prior work will serve as the foundation for the development of some of the study?s data collection instruments. The dissemination plan is strong and the Urban Institute appears well positioned to carry out this component of the scope of work.",Achievement; Address; Affect; Area; career; Cataloging; Catalogs; college; Data; Data Collection; Data Set; Development; Education; Effectiveness; Enrollment; Florida; Focus Groups; follow-up; Foundations; high school; Human Resources; indexing; Individual; insight; Institutes; Institution; instrument; interest; Interview; Knowledge; Learning; Mathematics; Methods; Outcome; peer; Policies; Positioning Attribute; Poverty; programs; Research; Research Personnel; Schools; Science; Site Visit; Source; Students; study characteristics; suburb; Testing; Transcript; Visit; Work,ON-TRACK FOR STEM CAREERS: ACCESS TO RIGOROUS AND RELEVANT STEM COURSES IN FLORIDA''S HIGH SCHOOLS,NSF,NSF,10/15/2008,9/30/2012,2008,996966.0
79,89817,"Computer security is a field in which defenses are pitted against adversaries.  Thus, it is critical to understand the capabilities and motivations of the adversary if one is to plan effective defenses.  However, modern Internet-based attacks are largely driven by economic factors that are only understood in the abstract.  While we know that it is sufficiently cheap to compromise Internet hosts that large-scale botnets have become a compelling platform for launching attacks, we simply do not understand the scale of the revenue that that such activities bring in.  While we understand that billions of spam e-mails are sent per day, the conversion rate of this spam ? the probability that a sent message will result in a ?sale? ? is largely unknown.  Absent such information it is difficult to reason about the structural nature of the conflict between attackers and defenders.Traditionally, obtaining information about the critical economic factors in Internet attacks is difficult because such information is only visible to the attacker themselves.  Our research is focused on sidestepping this issue by infiltrating the technical infrastructure ? the botnets themselves ? used by Internet miscreants.  Our technique, called ?distribution infiltration? provides a means to directly quantify key aspects of spam and phishing campaigns as well as to measure the impact of defenses on an economic footing (i.e., their impact on the profitability of e-crime).  Our research will both refine these methodologies and produce concrete data for developing economic-based threat models of computer security.",abstracting; base; Computer Security; Conflict (Psychology); Crime; Data; Economic Factors; Economics; foot; Incentives; Infiltration; Internet; Mails; Measures; Methodology; Modeling; Motivation; Nature; phishing; Probability; Research; Research Infrastructure; Sales; spam; Techniques,COLLABORATIVE RESEARCH: CT-M: UNDERSTANDING AND EXPLOITING ECONOMIC INCENTIVES IN INTERNET-BASED SCAMS,NSF,NSF,10/1/2008,9/30/2011,2008,500000.0
80,89813,THE EURASIAN FRESHWATER CYCLE FROM GRACE AND IN-S ITU HYDROLOGIC NETWORKS: DISTINGUISHING WATER CYCLE BEHAVIOR IN PERMAFROST AND NON-PERMAFROST REGIONS- We propose to use monthly values of time-variable gravity from GRACE in combination with runoff / prec,Behavior; Force of Gravity; Fresh Water; Time; Water,THE EURASIAN FRESHWATER CYCLE FROM GRACE AND IN-S ITU HYDROLOGIC NETWORKS: DISTINGUISHING WATER CYCLE BEHAVIOR IN PERMAFROST AND NON-PERMAFROST REGIONS- WE PROPOSE TO USE MONTHLY VALUES OF TIME-VARIABLE GRAVITY FROM GRACE IN COMBINATION WITH RUNOFF / PREC,NASA,NASA,10/1/2008,9/30/2010,2008,271328.0
81,89810,ISPI CASSINI - INSTANTANEOUS STELLAR PARALLAX INVESTIGATION VIA CASSINI- We propose a novel technique / ISPI (INSTANTANEOUS STELLAR PARALLAX INVESTIGATION) / to measure distances to astrophysical sources using a combination of Cassini in the Saturn system,Investigation; Measures; novel; Saturn; Source; System; Techniques,ISPI CASSINI - INSTANTANEOUS STELLAR PARALLAX INVESTIGATION VIA CASSINI- WE PROPOSE A NOVEL TECHNIQUE / ISPI (INSTANTANEOUS STELLAR PARALLAX INVESTIGATION) / TO MEASURE DISTANCES TO ASTROPHYSICAL SOURCES USING A COMBINATION OF CASSINI IN THE SATURN SYSTEM,NASA,NASA,10/1/2008,9/30/2010,2008,50000.0
