,PROJECT_ID,ABSTRACT,PROJECT_TERMS,PROJECT_TITLE,DEPARTMENT,AGENCY,PROJECT_START_DATE,PROJECT_END_DATE,FY,FY_TOTAL_COST
41,89939,"PI: David Hannapel (Iowa State University)CoPIs: Aragula G. Rao (Iowa State University), Jeff Coller (Case Western Reserve University), William J. Lucas (University of California, Davis)Plants perceive outside signals that activate pathways to control their defenses and growth. The length of daylight or photoperiod is a key signal that regulates growth processes like flowering in many plants and tuber formation in potato. Tuber formation in potato involves the transport of a light-activated signal from the leaf to the underground organ, the potato tuber. The overall scientific objective of this project is to study the range of signals that are responsible for controlling tuber formation. Signals involved in this process include both proteins and RNA. Two research goals will be addressed in this project: 1) To identify and characterize RNAs of potato that are transported from the leaf to the underground tuber and 2) To identify proteins that work with the RNAs to facilitate this transport. Several approaches will be undertaken to implement these research goals, including the systematic characterization of the network of RNAs and proteins present in this transport system. Proteins and RNAs will be identified and tested for their function in this signaling system. The primary goal of this project is to understand how this collection of signals regulates tuber formation. The utility of this research activity is that the information generated by these experiments will have direct applications for enhancing crop productivity. The broader scientific impacts resulting from this research activity are inherent in the enhancement of our understanding of how plants use light signals to control their growth and, for agronomic crops, to affect their yield. A significant component of this project is the educational and outreach features. The educational component will be implemented through the Summer Internship program that will provide high school and undergraduate students with the opportunity to participate in plant biology projects. As a component of outreach training, summer internships for high school biology teachers will also be offered. These teachers will work with project leaders on the Iowa State, UC-Davis, or Case Western Reserve campuses to learn more about plant biology. By targeting high school teachers who may teach up to 100 students a year, the influence of this program will be greatly expanded and will fulfill a primary mission of NSF; to communicate to society the significance of the outcomes of current research in plant biology. The international component of this project will expand the breadth of training available through this initiative and enhance global awareness of the scientific challenges addressed in this research. This project includes ample opportunities for participation by women and underrepresented groups in laboratory research. Project outcomes will be made available to the scientific community through a project website, which will be accessible via http://www.hort.iastate.edu/research/research-detail.php?id=1148.",Address; Affect; Awareness; Biological Models; Biology; California; Collection; Communities; direct application; Education and Outreach; Educational process of instructing; Flowers; Goals; Growth; high school; International; Internships; Iowa; Laboratory Research; Learning; Length; Light; Mission; Organ; Outcome; outreach; Pathway interactions; Photoperiod; Plant Leaves; Plants; Potato; Process; Productivity; programs; Proteins; Research; Research Activity; research study; RNA; School Teachers; Signal Transduction; Societies; Students; System; teacher; Testing; Training; Universities; web site; Woman; Work,TRANSFERRING RESEARCH FROM A MODEL SYSTEM TO UNCOVER THE NETWORK THAT REGULATES LONG-DISTANCE SIGNALING IN POTATO,NSF,NSF,10/1/2008,9/30/2011,2008,2154507.0
42,89937,"The project proposes a conference to stimulate a national conversation on new STEM learning research paradigms that cut across boundaries and investigate multiple contexts and media, rather than historical approaches that have viewed learning within limited temporal, spatial and socio-cultural contexts.The project will create a special peer-reviewed, international themed issue in the journal Science Education that reflects the meeting, convene the national conference of prominent learning sciences researchers, host a post-conference national web conference, follow-up on participants after one year, and host a series of national discussions around new paradigms in STEM at multiple national meetings.",follow-up; International; Internet; Journals; Learning; meetings; next generation; Participant; Peer Review; Research; Research Personnel; Science; science education; Series; symposium,TOWARDS THE NEXT GENERATION OF RESEARCH ON STEM LEARNING,NSF,NSF,10/1/2008,3/31/2012,2008,99999.0
43,89928,TRACKING PLAGIOCLASE AND HIGH-CA PYROXENE AS INDICATORS OF THE PATHOGENESIS OF ASTEROIDS 433 EROS This project entitled Tracking Plagioclase and High-Ca Pyroxene As Indicators of the Petrogenesis of Asteroid 433 Eros  aims to try to better understand the,Minor Planets; Pathogenesis,TRACKING PLAGIOCLASE AND HIGH-CA PYROXENE AS INDICATORS OF THE PATHOGENESIS OF ASTEROIDS 433 EROS THIS PROJECT ENTITLED TRACKING PLAGIOCLASE AND HIGH-CA PYROXENE AS INDICATORS OF THE PETROGENESIS OF ASTEROID 433 EROS'' AIMS TO TRY TO BETTER UNDERSTAND THE,NASA,NASA,7/1/2008,12/31/2010,2008,112432.0
44,89917,"This project examines the information seeking and using behaviors of decision makers who face decisions about their future R&D investments.   A number of trends have made these decisions more uncertain, notably  Open Innovation,  the globalization of science and technology, increasingly diverse sources of technical and scientific information, as well as the global outsourcing of research to developing economies.  There is substantial evidence that industrial decision makers lack needed information; are unaware of available information; or need a more inclusive model of appropriate decision processes.  The study sheds light on whether and why industry decision makers choose global R&D over U.S. R&D.  It does this by examining how firms that are global innovators use information about scientific and technical resources, together with other innovation-related data, to shape their investment decisions and competitive strategies.  The project is based on collaboration with the Center for Innovation Management Studies and the Industrial Research Institute (IRI), whose 250 members collectively fund and conduct about 75% of U.S. industrial research. These firms' day-to-day R&D investment decisions are transforming traditional company-owned R&D laboratories into the  Laboratory of the Future  (LOF). Each firm's own  LOF  may consist of a traditional laboratory, a collaborative laboratory, a virtual laboratory or a network of external resources, including university researchers in the U.S. or abroad, as well as government or private labs, collaborative strategic partners, or simulation tools thus augmenting or even replacing company owned physical labs. LOFs are highly likely to vary by industry and by the competitive environment of the firm. The study examines participants' discussions of these decisions and the information resources they use to decide how to build their future innovation capabilities. The project analyzes the LOF discussion to reveal how R&D managers think long-term and strategically about what they do.  The project documents information seeking and information using behavior as exhibited in an on-line discussion by the decision makers about the R&D  LOF . In addition the research opens a window into decision makers' rationales for their investment commitments.Broader Impacts: Corporate R&D executives are making decisions now that will, in the aggregate, shape the LOF and affect U.S. national innovation system. This project documents how they are making those decisions, what information they are presently using, and what kinds of data might be desirable for robust decisions. The project results inform both decision makers in industry and policy makers about data and information sources presently used, not used, and data not presently available but desirable for the future.",Affect; base; Behavior; Collaborations; Data; Decision Making; Environment; Exhibits; Face; Foundations; Funding; Future; Government; Industry; Information Resources; innovation; Investments; Laboratories; Light; member; Modeling; Outsourcing; Participant; Policy Maker; Process; Research; research and development; Research Institute; Research Personnel; Resources; Science; Shapes; simulation; Source; System; Technology; tool; trend; Universities; virtual,COLLABORATIVE RESEARCH - MOD: THE R&D ''LAB'' OF THE FUTURE: FOUNDATIONS FOR MODELING THE R&D/INNOVATION PLANNING PROCESS,NSF,NSF,10/1/2008,9/30/2010,2008,155648.0
45,89915,"NEBRASKA MATH is to improve achievement for all students and narrow achievement gaps among at-risk populations by focusing on three key transition points along the mathematics continuum: the mathematics education of children in transition from kindergarten through early primary to grade 3; the algebra transition from middle to high school and the transition of new secondary math teachers from certification to the classroom.  The project is focused on four strategies; (i) Developing an active and mature partnership (sustained through state dollars after the end of NSF funding) by linking mathematics teachers and school administrators from across Nebraska with university mathematicians and mathematics educators and early childhood educators to improve mathematics education statewide; (ii) Strengthening the mathematical and pedagogical knowledge for teaching of participating teachers and their professional interactions with other teachers in their schools, while improving their attitudes to the teaching and learning of mathematics; (iii) Improving students' competence, beliefs and attitudes about mathematics, their appreciation of the importance of sustained effort, and their knowledge of mathematics; and (iv)) Contributing to the research in mathematics education through a mixed methods research design studying K-3 teacher's knowledge, attitudes, and leadership in relation to student disposition and achievement.A goal of the project is to create a model partnership, both on the University of Nebraska-Lincoln (UNL) campus and nationally, where faculty in an academic discipline (in this case mathematics) and faculty in education work with teachers and administrators from the K-12 education community, sharing expertise and resources in pursuit of a world class mathematics education system.  NEBRASKA MATH partners the University of Nebraska-Lincoln with four school districts and 15 Educational Service Units (ESUs), in rural Nebraska, which provide support to 63 additional school districts.  The intent is to form a permanent K-16 mathematics partnership that is sustained primarily by local dollars.  Over the five years the project is to impact 900 teachers (750 at the elementary level and 150 at the secondary level) and approximately 60,000 students.",Achievement; Administrator; Attitude; Belief; Certification; Child; Community Health Education; Competence; Discipline; early childhood; Education; Educational process of instructing; Faculty; Funding; Goals; high school; improved; kindergarten; Knowledge; Leadership; Learning; Link; Mathematics; Methods; Modeling; Nebraska; Populations at Risk; Research; Research Design; Resources; Rural; School Teachers; Schools; Services; Students; System; teacher; Universities; Work,NEBRASKA MATH,NSF,NSF,1/1/2009,12/31/2013,2008,9235407.0
46,89914,"The period between the late-Pleistocene glacial maximum and the early-Holocene thermal maximum (ca. 21,000 to 7,000 years ago) was a time of dramatic environmental change and biotic adjustments. The creation of new ecosystems in deglaciated regions was governed by the rate of ice recession, the nature of postglacial climate change, the characteristics of new landscapes, and the life-history traits of the biologic colonizers.The Yellowstone region supported the largest independent ice field in the western U.S., and ice recession after 17 cal ka set in motion a sequence of poorly-documented biologic events that ultimately led to the present-day terrestrial and aquatic ecosystems. This examination of the late-glacial and early-Holocene periods in the Yellowstone region poses the following questions: What are the primary controls of terrestrial and aquatic ecosystem development on newly created landscapes? Specifically, how are past biota influenced by intrinsic biological constraints, landscape evolution, and subregional climate differences during a period of dramatic climate change? The study tests hypotheses concerning the importance of climatic and nonclimatic drivers in ecosystem development through an examination of lake-sediment records from sites that (1) lie along the path of ice recession, (2) span a variety of substrates, and (3) are situated within summer-wet and summer-dry precipitation regimes.Yellowstone is an ideal region to examine the development and structuring of terrestrial and aquatic ecosystems, because (1) the climate history of the western US is reasonably well understood from prior data syntheses and paleoclimate model simulations; (2) a well-documented glacial history of the Yellowstone region offers independent information on local environmental change; (3) different substrates and precipitation regimes shape modern ecosystem distributions and likely have in the past as well; and (4) previous paleoecologic findings motivate more-nuanced research questions that can be addressed with the acquisition of new high-resolution records.Intellectual Merit of the Research: Understanding the biotic consequences of climatic change is a major challenge in Earth systems research and identified as a high priority in recent international and US climate change assessments. The proposed study builds on existing knowledge of Yellowstone's past in an effort to better understand the resilience of terrestrial and aquatic ecosystems to environmental change, including abrupt climate events of the magnitude projected in the future. This project adopts a stratified sampling approach that is not possible in most locations where paleobiotic data are sparse, and the information gained will help answer basic biologic questions about the importance of abiotic and biotic variables in modulating the effects of climate change on species, communities, and ecosystems. The resulting synthesis will be a critical step in bridging the gap between current understanding of ecological processes on short time scales and evidence of dramatic change preserved in paleoecologic data on long time scales.Broader Impacts of the Research lie in its contribution to ongoing efforts that better inform the public, land and resource managers, and students about the importance of environmental history in the national parks, including an understanding of past climate change and ecosystem sensitivity. This project in particular, extends outreach activities in a number of ways, among them regularly updated web-disseminated information by the National Park Service on Yellowstone's history; education and training activities for Park staff on cutting-edge paleoclimate research; incorporation of Yellowstone findings in Park-directed K-12 curricula and university coursework; publication in popular scientific magazines; and content for a new museum exhibit on Yellowstone. The project also continues the PIs' commitment to train and educate the next generation of diverse scientists and to contribute to ongoing efforts to build multidisciplinary paleoclimate datasets for use by researchers, land managers, educators, and the public.",Address; Adopted; Biological; Biota; Characteristics; Climate; climate change; Communities; Data; Data Set; Development; Ecosystem; Education; Educational Curriculum; environmental change; Event; Evolution; Exhibits; Future; Ice; International; Internet; Journals; Knowledge; life history; Location; models and simulation; Motion; multidisciplinary; Museums; Nature; next generation; outreach; Precipitation; Process; Publications; Recording of previous events; Records; Research; Research Personnel; resilience; Resolution; Resources; Sampling; Scientist; Services; Shapes; Site; Structure; Students; systems research; Testing; Time; Training; Training Activity; trait; Universities; Update,COLLABORATIVE RESEARCH: CONTROLS OF ECOSYSTEM DEVELOPMENT DURING RAPID ENVIRONMENTAL CHANGE: YELLOWSTONE IN THE LATE-GLACIAL AND EARLY-HOLOCENE PERIODS,NSF,NSF,10/1/2008,9/30/2011,2008,184991.0
47,89905,"For nearly a century, biologists have debated whether past climate change promoted speciation in temperate zone organisms.  Models of climate-driven geographic speciation were developed for many groups of temperate organisms, and a particularly detailed and explicit speciation model was developed for North American birds. Over the last decade, this paradigm for North American birds has become the topic of debate, and so a comprehensive understanding of how temperate zone birds were impacted by past environmental change events remains elusive. This project will directly test the paradigm and will significantly extend understanding of the history of the fauna of pine and oak woodlands. The work will use state-of-the-art molecular techniques and analyses to examine the temporal and spatial patterns of diversification of North American birds in relation to past environmental change and will produce a multi-locus comparative phylogeography of pine and oak woodland birds. The project provides significant mentoring and research opportunities for undergraduate and graduate students, including many students from underrepresented groups, and gives these students a unique opportunity to work in a multi-institutional and multidisciplinary research effort between a small rural university and two large urban research universities. The project also will support a workshop for high school teachers from the rural and reservation communities of western South Dakota and provide them the knowledge and resources to teach about climate change and its impact on biotic diversity in their classrooms.",American; Arts; Birds; Climate; climate change; comparative; Educational process of instructing; Educational workshop; environmental change; Event; graduate student; high school; Indian reservation; Interdisciplinary Study; Knowledge; Mentors; Modeling; Molecular; North America; Organism; Pattern; Recording of previous events; Research; Resources; Rural; School Teachers; South Dakota; Students; Techniques; Testing; Universities; Work,COLLABORATIVE RESEARCH: MULTILOCUS COMPARATIVE PHYLOGEOGRAPHY OF PINE-OAK WOODLAND BIRDS IN NORTH AMERICA,NSF,NSF,10/1/2008,9/30/2012,2008,246816.0
48,89903,"This project is a novel alliance among the state school system, Jackson State University (JSU), Jackson Public Schools and other public schools in Mississippi. The project also partners with the Ironwood Observatory and Education Center in Hawaii, the James Cook Universtiy Center for Astronomy in Australia and the NASA Stennis Space Center in Mississippi. The focus of the partnership is on high school physics, chemistry and earth science. The project anticipates enabling 45 preservice teachers to obtain teaching licenses in high school science. Courses will be designed and taught by the College of Education and Human Development and the College of Science, Engineering and Technology. The project will provide 200 inservice teachers with 160 hours of professional development. The goal is to enable teachers to implement National Science Education Standards and the Mississippi Science Curriculum Frameworks for high school (9-12) education. The long term goal is to improve student achievement in science and to significantly reduce achievement gaps in the science performance within the diverse student population. The inservice component consists of two compressed 3 credit hours graduate courses. Each course will be taught in 10 days (20 days total), two weeks in summer and 10 Saturdays during the academic year. The emphasis will be on conceptual development for each major topic and will include coursework, inquiry-based laboratory work, demonstrations, hands-on activities, and problem solving with special emphasis on using technology as tools of instruction. Project team members will complete at least three follow-up visits to the classrooms of the participants.",Academy; Achievement; Astronomy; Australia; base; Chemistry; college; cooking; design; Development; Drosophila chb protein; Education; Educational Curriculum; Educational process of instructing; Engineering; follow-up; Goals; Hand; Hawaii; high school; Hour; Human Development; improved; Instruction; Laboratories; Licensing; member; Mississippi; novel; Participant; Performance; Physics; Population; Problem Solving; Schools; Science; science education; Students; System; teacher; Technology; tool; United States National Aeronautics and Space Administration; Universities; Visit; Work,MISSISSIPPI ACADEMY FOR SCIENCE TEACHING-- PROJECT MAST,NSF,NSF,10/1/2008,9/30/2012,2008,6810008.0
49,90182,PHASE II: NASA TECHNOLOGY TRANSFER AND INNOVATIVE PARTNERSHIP PROGRAM The National Technology Transfer Center (NTTC) promotes technology infusion by creating awareness of technologies and areas of expertise developed in the NASA SBlR/STTR Program - and el,Area; Awareness; Infusion procedures; innovation; Phase; programs; Small Business Technology Transfer Research; Technology; Technology Transfer; United States National Aeronautics and Space Administration,PHASE II: NASA TECHNOLOGY TRANSFER AND INNOVATIVE PARTNERSHIP PROGRAM THE NATIONAL TECHNOLOGY TRANSFER CENTER (NTTC) PROMOTES TECHNOLOGY INFUSION BY CREATING AWARENESS OF TECHNOLOGIES AND AREAS OF EXPERTISE DEVELOPED IN THE NASA SBLR/STTR PROGRAM - AND EL,NASA,NASA,9/1/2008,12/31/2010,2008,2044000.0
50,89901,NASA URC SPACE CENTER CONTINUATION CALIFORNIA STATE UNIVERSITY - LOS ANGELES This proposal requests funds to continue the investigation and development of key technologies related to critical NASA missions and programs. The research and associated educati,California; Development; Funding; Investigation; Los Angeles; Mission; Postdoctoral Fellow; programs; Request for Proposals; Technology; United States National Aeronautics and Space Administration; Universities,NASA URC SPACE CENTER CONTINUATION CALIFORNIA STATE UNIVERSITY - LOS ANGELES THIS PROPOSAL REQUESTS FUNDS TO CONTINUE THE INVESTIGATION AND DEVELOPMENT OF KEY TECHNOLOGIES RELATED TO CRITICAL NASA MISSIONS AND PROGRAMS. THE RESEARCH AND ASSOCIATED EDUCATI,NASA,NASA,10/1/2008,11/30/2010,2008,2000000.0
51,89900,"CBET-0829092CannonNumerous U.S. groundwater sources host unacceptable levels of perchlorate, nitrate, chromate, vanadate, etc.  Available processes for removing these contaminants generally invoke use of petrochemical-based ion exchange media or membranes, which force municipalities and their suppliers to rely on non-renewable raw materials that are mined from non-sustainable and uncertain sources.  The investigators are targeting to devise means of employing instead lignocellulosic biomaterials (biocarbons) that originate naturally from within America.  The team will build on their recently-devised means of functionalizing the porous biocarbons with reduced-nitrogen groups that remove perchlorate and other oxyanions.  The project will link into the Sloan Fellowship program for Minority Ph.D. candidates at Penn State, which is co-led by PI Dr. Cannon.  There will also be participation in Penn State's CURO program, which facilitates minority undergraduate research.",Americas; base; Biocompatible Materials; Chromates; Doctor of Philosophy; Fellowship Program; Ion Exchange; Link; Membrane; Mining; Minority; Municipalities; Nitrates; Nitrogen; Perchlorates; Process; programs; Research; Research Personnel; Source; Vanadates; Water,"GOALI: US-NATIVE BIOMATERIALS, NITROGEN-FUNCTIONALIZED TO ADSORB PERCHLORATE AND OTHER OXYANIONS FROM WATER",NSF,NSF,10/1/2008,9/30/2012,2008,377500.0
